{
  "all_controls_passed": true,
  "arm_run_count": 48,
  "environment_lock_relpath": "requirements-lock.txt",
  "environment_lock_sha256": "89f9a02b7c8c3171c77fb8cb249db349f207a5cf32f5c3fbd423785a24af5c94",
  "evidence_archive": {
    "format": "deterministic_uncompressed_tar_of_float64_arrays",
    "relpath": "data/evidence/beta_plane/control_final_states.tar",
    "sha256": "d32b7400d45d90106cf6c956a2653346f483d074ba34d8d0911d25bd800d5bbb"
  },
  "generator": "scripts/run_beta_plane_controls.py",
  "preregistration_relpath": "data/registry/beta_plane_sweep_preregistration.json",
  "preregistration_sha256": "babd518f60bbfece217632411536cfeae81b4715b6de0401d1798822602ac0b5",
  "prescribed_zonal_diagnostic_control": {
    "expected_total_jet_count": 8,
    "full_window_classification": {
      "mean_zonal_fraction": 0.9999999999999977,
      "minimum_zonal_fraction": 0.9999999999999976,
      "modal_jet_count": 8,
      "modal_jet_count_occupancy": 1.0,
      "persistent_jet": true,
      "tenth_percentile_zonal_fraction": 0.9999999999999976
    },
    "observed_total_jet_count": 8,
    "passed": true,
    "prescribed_zonal_wavenumber": 4,
    "prominence_threshold": 0.007071067811865475,
    "spectral_zonal_energy_fraction": 1.0,
    "zonal_kinetic_energy_fraction": 0.9999999999999976
  },
  "records": [
    {
      "archive_members": {
        "f_plane": "seed_011/f_plane.f64",
        "identity": "seed_011/identity.f64",
        "quotient": "seed_011/quotient.f64",
        "rotated_f_plane": "seed_011/rotated_f_plane.f64"
      },
      "array_dtype": "float64_row_major",
      "array_shape": [
        64,
        64
      ],
      "budget_passed": true,
      "f_plane_final_sha256": "125592ecea62dba207764e065123be73797e3b351f126b7762a6a53e3f8c1e33",
      "f_plane_rotation_relative_vorticity_error": 1.1357737131231767e-14,
      "identity_final_sha256": "29f934e9140d2f94a01fe6f06b9439d4cd06f15e4966587b0a85b3fef04648dd",
      "maximum_absolute_budget_residual": 1.5124643482078426e-09,
      "quotient_final_sha256": "29f934e9140d2f94a01fe6f06b9439d4cd06f15e4966587b0a85b3fef04648dd",
      "quotient_sentinel_passed": true,
      "quotient_to_identity_maximum_vorticity_error": 0.0,
      "rotated_f_plane_final_sha256": "efb33318cf6320a4f8d1ee42a7acf7c6f05fe9c61a3b7b4cf6f605fecf8f509d",
      "rotation_covariance_passed": true,
      "seed": 11
    },
    {
      "archive_members": {
        "f_plane": "seed_029/f_plane.f64",
        "identity": "seed_029/identity.f64",
        "quotient": "seed_029/quotient.f64",
        "rotated_f_plane": "seed_029/rotated_f_plane.f64"
      },
      "array_dtype": "float64_row_major",
      "array_shape": [
        64,
        64
      ],
      "budget_passed": true,
      "f_plane_final_sha256": "bec25ddcce2443465af0b124e309183b65f8388272b59a6585e1de2e86c01944",
      "f_plane_rotation_relative_vorticity_error": 9.247589433949746e-15,
      "identity_final_sha256": "11691ca5209ac38640d8883d7e7b847dca7e33bbb3b44a2cb72447b96198a3dc",
      "maximum_absolute_budget_residual": 1.4081344701377674e-09,
      "quotient_final_sha256": "11691ca5209ac38640d8883d7e7b847dca7e33bbb3b44a2cb72447b96198a3dc",
      "quotient_sentinel_passed": true,
      "quotient_to_identity_maximum_vorticity_error": 0.0,
      "rotated_f_plane_final_sha256": "2ec64ff2ffeb80860c0ab61a1dd746124c7a7bbb3a214547359262faca2f9009",
      "rotation_covariance_passed": true,
      "seed": 29
    },
    {
      "archive_members": {
        "f_plane": "seed_047/f_plane.f64",
        "identity": "seed_047/identity.f64",
        "quotient": "seed_047/quotient.f64",
        "rotated_f_plane": "seed_047/rotated_f_plane.f64"
      },
      "array_dtype": "float64_row_major",
      "array_shape": [
        64,
        64
      ],
      "budget_passed": true,
      "f_plane_final_sha256": "3ae8930e6f99cec1632f1794489902639c29fe11153122cbfa5995c3742ef6f6",
      "f_plane_rotation_relative_vorticity_error": 1.0801293222800662e-14,
      "identity_final_sha256": "ecf30c6af49f579f2814681dcd372810bd272f17ce3548eb01ee1a453dd94524",
      "maximum_absolute_budget_residual": 1.413008626771628e-09,
      "quotient_final_sha256": "ecf30c6af49f579f2814681dcd372810bd272f17ce3548eb01ee1a453dd94524",
      "quotient_sentinel_passed": true,
      "quotient_to_identity_maximum_vorticity_error": 0.0,
      "rotated_f_plane_final_sha256": "c5d825ee2023f9bdd171f7e9f9013a4ea167128602226af4e4055ab9e72de7a1",
      "rotation_covariance_passed": true,
      "seed": 47
    },
    {
      "archive_members": {
        "f_plane": "seed_071/f_plane.f64",
        "identity": "seed_071/identity.f64",
        "quotient": "seed_071/quotient.f64",
        "rotated_f_plane": "seed_071/rotated_f_plane.f64"
      },
      "array_dtype": "float64_row_major",
      "array_shape": [
        64,
        64
      ],
      "budget_passed": true,
      "f_plane_final_sha256": "50a77310ee7c8f786a286089be398f44a307f0dd15490cdaf0f3e0cb200cb47f",
      "f_plane_rotation_relative_vorticity_error": 1.5402323505765776e-14,
      "identity_final_sha256": "dd643c5720f16fd6ac6308f579d1b80dcd74796fe558fca911ea2a44ceeca0f6",
      "maximum_absolute_budget_residual": 1.59952973088906e-09,
      "quotient_final_sha256": "dd643c5720f16fd6ac6308f579d1b80dcd74796fe558fca911ea2a44ceeca0f6",
      "quotient_sentinel_passed": true,
      "quotient_to_identity_maximum_vorticity_error": 0.0,
      "rotated_f_plane_final_sha256": "58e2902520be230e06c77dca3e16ff65ca19eae3779019be1113160cf17ee809",
      "rotation_covariance_passed": true,
      "seed": 71
    },
    {
      "archive_members": {
        "f_plane": "seed_089/f_plane.f64",
        "identity": "seed_089/identity.f64",
        "quotient": "seed_089/quotient.f64",
        "rotated_f_plane": "seed_089/rotated_f_plane.f64"
      },
      "array_dtype": "float64_row_major",
      "array_shape": [
        64,
        64
      ],
      "budget_passed": true,
      "f_plane_final_sha256": "78276704115602e4dda39b162feb7ba6820eff11571a91985b483c3b4dc23554",
      "f_plane_rotation_relative_vorticity_error": 1.0981358457591733e-14,
      "identity_final_sha256": "53c2d23e05f3926becf1a8df18da6c8c8d459ddaa3333295214519f0e7547834",
      "maximum_absolute_budget_residual": 1.4377616597283094e-09,
      "quotient_final_sha256": "53c2d23e05f3926becf1a8df18da6c8c8d459ddaa3333295214519f0e7547834",
      "quotient_sentinel_passed": true,
      "quotient_to_identity_maximum_vorticity_error": 0.0,
      "rotated_f_plane_final_sha256": "dbc18f2120a38ada115e0714fbd784d3e97e438c8bd65c45cd6a1d2cd909412b",
      "rotation_covariance_passed": true,
      "seed": 89
    },
    {
      "archive_members": {
        "f_plane": "seed_107/f_plane.f64",
        "identity": "seed_107/identity.f64",
        "quotient": "seed_107/quotient.f64",
        "rotated_f_plane": "seed_107/rotated_f_plane.f64"
      },
      "array_dtype": "float64_row_major",
      "array_shape": [
        64,
        64
      ],
      "budget_passed": true,
      "f_plane_final_sha256": "91c08845d52586d8652030363adc217e3096ef23747eff229d00a1720cd76cec",
      "f_plane_rotation_relative_vorticity_error": 1.0541025627603213e-14,
      "identity_final_sha256": "0937ca67d1db39be25c315359b97e232f4c312bedaddbb81f216bf2d2c6352cf",
      "maximum_absolute_budget_residual": 1.864767840142889e-09,
      "quotient_final_sha256": "0937ca67d1db39be25c315359b97e232f4c312bedaddbb81f216bf2d2c6352cf",
      "quotient_sentinel_passed": true,
      "quotient_to_identity_maximum_vorticity_error": 0.0,
      "rotated_f_plane_final_sha256": "8932accba924a1a49f55ff582dec0c6234f19edf1bb99854ce8ba210b922664b",
      "rotation_covariance_passed": true,
      "seed": 107
    },
    {
      "archive_members": {
        "f_plane": "seed_131/f_plane.f64",
        "identity": "seed_131/identity.f64",
        "quotient": "seed_131/quotient.f64",
        "rotated_f_plane": "seed_131/rotated_f_plane.f64"
      },
      "array_dtype": "float64_row_major",
      "array_shape": [
        64,
        64
      ],
      "budget_passed": true,
      "f_plane_final_sha256": "57ef4b56f8fa8a92fe8edcfe38810145c6e5eee05102ec0d4de04d43cc44e5cb",
      "f_plane_rotation_relative_vorticity_error": 1.0475343463842163e-14,
      "identity_final_sha256": "7e2ee4065c38201e8550cad9f4483df2558da17a10563691ef403c8e04044bf3",
      "maximum_absolute_budget_residual": 1.5554839916109842e-09,
      "quotient_final_sha256": "7e2ee4065c38201e8550cad9f4483df2558da17a10563691ef403c8e04044bf3",
      "quotient_sentinel_passed": true,
      "quotient_to_identity_maximum_vorticity_error": 0.0,
      "rotated_f_plane_final_sha256": "928cac44c04b6c50c4a3ef039e6cee900fcf22316cd116a9ee8dd3ebd51f294c",
      "rotation_covariance_passed": true,
      "seed": 131
    },
    {
      "archive_members": {
        "f_plane": "seed_149/f_plane.f64",
        "identity": "seed_149/identity.f64",
        "quotient": "seed_149/quotient.f64",
        "rotated_f_plane": "seed_149/rotated_f_plane.f64"
      },
      "array_dtype": "float64_row_major",
      "array_shape": [
        64,
        64
      ],
      "budget_passed": true,
      "f_plane_final_sha256": "915ac6c31596134b0f54206dc0ce40be462b8c26c48cb6286bd72e3f22c572cc",
      "f_plane_rotation_relative_vorticity_error": 1.0197463165633896e-14,
      "identity_final_sha256": "d0641c432854806d069c8f29193a85068f78b0a0117b17d99b7fa60c186f31d3",
      "maximum_absolute_budget_residual": 1.5874093706180759e-09,
      "quotient_final_sha256": "d0641c432854806d069c8f29193a85068f78b0a0117b17d99b7fa60c186f31d3",
      "quotient_sentinel_passed": true,
      "quotient_to_identity_maximum_vorticity_error": 0.0,
      "rotated_f_plane_final_sha256": "b608dddc32d46d22d3b5ebdc711d58030818e1e5272b7469d13c76e991dcf885",
      "rotation_covariance_passed": true,
      "seed": 149
    },
    {
      "archive_members": {
        "f_plane": "seed_167/f_plane.f64",
        "identity": "seed_167/identity.f64",